{
  "schema_version": "1.0.0",
  "message_type": "analysis_result",
  "is_example": true,
  "node_id": "example-node-04",
  "asset_id": "example-generator-04",
  "boot_id": "f683fa37-34ae-4d9e-a231-e66f6b486e1b",
  "record_seq": 1,
  "source_kind": "scenario",
  "source_ref": "contract-fixture/40hz-sine-not-a-generator",
  "measured_at": "2026-10-10T06:00:00.000Z",
  "monotonic_start_us": 60000000,
  "input_window": {
    "window_seq": 31,
    "sample_count": 832,
    "sample_rate_hz": 416.000032
  },
  "features": {
    "axes": [
      "x",
      "y",
      "z"
    ],
    "rms_g": 0.04472136,
    "rms_ratio": null,
    "kurtosis": 1.500000005,
    "dominant_frequency_hz": 40.000003
  },
  "baseline": {
    "id": null,
    "rms_g": null
  },
  "health_state": "calibrating",
  "reason_codes": [
    "baseline_collecting"
  ],
  "quality_state": "ok",
  "quality_flags": [],
  "model_version": "example-rms-rule-v1",
  "warning_event_id": null,
  "rul": null,
  "additional_measurements": {
    "surface_temperature_c": null,
    "current_a": null,
    "oil_level_pct": null
  }
}
